{
  "id": "TAE-901",
  "name": "インライン合成した決済機能のシステムテスト",
  "element_type": "function_responsibility_group",
  "test_level": "system",
  "test_type": "functional",
  "test_cycle": "new_feature_test",
  "risk_level": "high",
  "thickness": "thick",
  "assigned_conditions": ["DTC-001", "DTC-002"],
  "delegated_to": null,
  "rationale": "上流の TAE がないため、現行成果物集合で未使用の TAE-9xx を割り当てた"
}
